{"artifacts":{"files":["meta.json","quality.json","network.json","model.json","solutions.json","robustness.json","solver_test_vectors.json","facts.json"]},"attribution":"Source: U.S. Census Bureau, Population Estimates Program (PEP) 2025 and Gazetteer Files 2026. This product uses Census Bureau data but is not endorsed or certified by the Census Bureau. Network, costs and all solver and Monte Carlo outputs are SYNTHETIC.","generated_at":"2026-10-11T04:03:21Z","licence_note":"Public-domain status of Census files was not verifiable (copyright page 404); attribution only, no endorsement implied. FAF5 not used (BTS 403).","limitations":["The network, costs and capacities are synthetic; results are not statements about any real supply chain.","Distances are great-circle x 1.2, not road routes; internal points are not facilities.","Monte Carlo outcomes are SIMULATED, evaluated for fixed designs; the design is not optimised against disruptions.","Duals are conditional on the optimal open set."],"project":"07-supply-chain-orchestra","schema_version":"v1","seed":20261011,"sizes":{"binaries":14,"candidate_sites":14,"columns":1640,"commodities":3,"demand_nodes":100,"out_arcs":500,"plants":3,"rows":1866},"sources":[{"bytes":1214650,"id":"gazetteer","name":"U.S. Census Bureau, Gazetteer Files 2026, places","retrieved_at_utc":"2026-10-11T04:03:21Z","sha256":"af678e2d990827c89ee39b98c82de6e90b693c7361ff0e559ae3076670dd2863","tag":"OBSERVED","url":"https://www2.census.gov/geo/docs/maps-data/data/gazetteer/2026_Gazetteer/2026_Gaz_place_national.zip","use":"internal-point coordinates, GEOID, FUNCSTAT","vintage":"2026"},{"bytes":7464556,"id":"pep","name":"U.S. Census Bureau, Population Estimates Program, sub-est2025","retrieved_at_utc":"2026-10-11T04:03:21Z","sha256":"e3508f5201465913476d4ddf91740f191f7977c9f2614a2a7e30b5fd22027934","tag":"OBSERVED","url":"https://www2.census.gov/programs-surveys/popest/datasets/2020-2025/cities/totals/sub-est2025.csv","use":"2025 population estimate, SUMLEV 162","vintage":"Vintage 2025"}],"tagline":"Every Product Has a Journey","tags":{"sizes":"SYNTHETIC","sources":"OBSERVED"}}
